productLine,productLineDescription,totalInventory,totalSales,totalRevenue,salesToInventoryPercentage
Ships,"The perfect holiday or anniversary gift for executives, clients, friends, and family. These handcrafted model ships are unique, stunning works of art that will be treasured for generations! They come fully assembled and ready for display in the home or office. We guarantee the highest quality, and best value.",732251,8532,663998.34,1.1652
"Trucks and Buses","The Truck and Bus models are realistic replicas of buses and specialized trucks produced from the early 1920s to present. The models range in size from 1:12 to 1:50 scale and include numerous limited edition and several out-of-production vehicles. Materials used include tin, diecast and plastic. All models include a certificate of authenticity from their manufacturers and are a perfect ornament for the home and office.",1003828,11001,1024113.57,1.0959
Planes,"Unique, diecast airplane and helicopter replicas suitable for collections, as well as home, office or classroom decorations. Models contain stunning details such as official logos and insignias, rotating jet engines and propellers, retractable wheels, and so on. Most come fully assembled and with a certificate of authenticity from their manufacturers.",1744036,11872,954637.54,0.6807
Motorcycles,"Our motorcycles are state of the art replicas of classic as well as contemporary motorcycle legends such as Harley Davidson, Ducati and Vespa. Models contain stunning details such as official logos, rotating wheels, working kickstand, front suspension, gear-shift lever, footbrake lever, and drive chain. Materials used include diecast and plastic. The models range in size from 1:10 to 1:50 scale and include numerous limited edition and several out-of-production vehicles. All models come fully assembled and ready for display in the home or office. Most include a certificate of authenticity.",1915517,12778,1121426.12,0.6671
"Vintage Cars","Our Vintage Car models realistically portray automobiles produced from the early 1900s through the 1940s. Materials used include Bakelite, diecast, plastic and wood. Most of the replicas are in the 1:18 and 1:24 scale sizes, which provide the optimum in detail and accuracy. Prices range from $30.00 up to $180.00 for some special limited edition replicas. All models include a certificate of authenticity from their manufacturers and come fully assembled and ready for display in the home or office.",3439570,22933,1797559.63,0.6667
Trains,"Model trains are a rewarding hobby for enthusiasts of all ages. Whether you're looking for collectible wooden trains, electric streetcars or locomotives, you'll find a number of great choices for any budget within this category. The interactive aspect of trains makes toy trains perfect for young children. The wooden train sets are ideal for children under the age of 5.",450792,2818,188532.92,0.6251
"Classic Cars","Attention car enthusiasts: Make your wildest car ownership dreams come true. Whether you are looking for classic muscle cars, dream sports cars or movie-inspired miniatures, you will find great choices in this category. These replicas feature superb attention to detail and craftsmanship and offer features such as working steering system, opening forward compartment, opening rear trunk with removable spare wheel, 4-wheel independent spring suspension, and so on. The models range in size from 1:10 to 1:24 scale and include numerous limited edition and several out-of-production vehicles. All models include a certificate of authenticity from their manufacturers and come fully assembled and ready for display in the home or office.",5851766,35582,3853922.49,0.6081
